唉,"interjection or grunt of agreement or recognition (e.g. yes, it's me!); to sigh"
爱护,to cherish; to treasure; to take care of; to love and protect
爱惜,to cherish; to treasure; to use sparingly
爱心,compassion; CL:片[pian4]
安慰,to comfort; to console; CL:個|个[ge4]
安装,install; erect; fix; mount; installation
岸,bank; shore; beach; coast; CL:個|个[ge4]
把握,to grasp (also fig.); to seize; to hold; assurance; certainty; sure (of the outcome)
摆,to arrange; to exhibit; to move to and fro; a pendulum
班主任,a teacher in charge of a class
办理,to handle; to transact; to conduct
棒,a stick; club or cudgel; smart; capable; strong; wonderful; classifier for legs of a relay race
傍晚,in the evening; when night falls; towards evening; at night fall; at dusk
包裹,wrap up; bind up; bundle; parcel; package; CL:個|个[ge4]
包含,to contain; to embody; to include
包子,steamed stuffed bun; CL:個|个[ge4]
薄,thin; cold in manner; indifferent; weak; light; infertile
宝贝,treasured object; treasure; darling; baby; cowry; good-for-nothing or queer character
宝贵,valuable; precious; value; treasure; set store by
保持,to keep; to maintain; to hold; to preserve
保存,to conserve; to preserve; to keep; to save (a file etc) (computing)
保留,to retain; to continue to have; to preserve; to maintain; to reserve; reservations; to hold back (approval or acceptance)
保险,insurance; to insure; safe; secure; be sure; be bound to; CL:份[fen4]
报告,"to inform; report; make known; speech; talk; lecture; CL:篇[pian1],份[fen4],個|个[ge4],通[tong4]"
悲观,pessimistic
背,"back; the backside; to do something behind someone's back; to learn and recite something by heart; unlucky
"
背景,background; backdrop; context; CL:種|种[zhong3]
被子,quilt; CL:床[chuang2]
本科,undergraduate course; undergraduate (adjective)
本领,"skill; ability; capability; CL:項|项[xiang4],個|个[ge4]"
本质,essence; nature; innate character; intrinsic quality
比例,proportion; scale
比如,for example; for instance; such as
彼此,each other; one another
毕竟,after all; all in all; when all is said and done; in the final analysis
避免,to avert; to prevent; to avoid; to refrain from
必然,inevitable; certain; necessity
必需,to need; to require; essential; indispensable
必要,necessary; essential; indispensable; required
编辑,to edit; to compile; editor; compiler
鞭炮,firecrackers; a string of small firecrackers; CL:枚[mei2]
便,ordinary; plain; convenient; as convenient; when the chance arises; handy; easy; informal; simple; so; thus; to relieve oneself; to urinate; to defecate; equivalent to 就: then; in that case; even if; soon afterwards
辩论,"debate; argument; to argue over; CL:場|场[chang3],次[ci4]"
标点,punctuation; a punctuation mark; to punctuate; CL:個|个[ge4]
标志,sign; mark; symbol; symbolize; to indicate; to mark
表面,surface; face; outside; appearance
表明,to make clear; to make known; to state clearly; to indicate; known
表情,(facial) expression; to express one's feelings; expression
表现,to show; to show off; to display; to manifest; expression; manifestation; show; display; performance (at work etc)
丙,"third of 10 heavenly stems 十天干; third in order; letter ""C"" or roman ""III"" in list ""A, B, C"", or ""I, II, III"" etc; propyl"
病毒,virus
玻璃,"glass; nylon; plastic; CL:張|张[zhang1],塊|块[kuai4]"
博物馆,museum
脖子,neck; CL:個|个[ge4]
不必,need not; does not have to
不断,unceasing; uninterrupted; continuous; constant
不见得,not necessarily; not likely
不耐烦,impatience; impatient
不要紧,unimportant; not serious; it doesn't matter; never mind; it looks all right; but
补充,to replenish; to supplement; to complement; additional; supplementary; CL:個|个[ge4]
布,cloth; to declare; to announce; to spread; to make known
不安,unpeaceful; unstable; uneasy; disturbed; restless; worried
不得了,desperately serious; disastrous; extremely; exceedingly
不好意思,to feel embarrassed; to be ill at ease; to find it embarrassing (to do sth)
不免,unavoidable
不然,not so; no; or else; otherwise; if not
不如,not equal to; not as good as; inferior to; it would be better to
不足,insufficient; lacking; deficiency; not enough; inadequate; not worth; cannot; should not
部门,department; branch; section; division; CL:個|个[ge4]
步骤,step; move; measure
财产,property; CL:筆|笔[bi3]
踩,to step on; to tread; to stamp; to press a pedal; to pedal (a bike)
采访,to interview; to gather news; to hunt for and collect; to cover
采取,"to adopt or carry out (measures, policies, course of action); to take"
彩虹,rainbow
参考,consultation; reference; to consult; to refer
参与,to participate (in sth)
餐厅,"dining-hall; dining-room; restaurant; CL:間|间[jian1],家[jia1]"
残疾,disabled; handicapped; deformity on a person or animal
惭愧,ashamed
操场,playground; sports field; drill ground; CL:個|个[ge4]
操心,to worry about
册,book; booklet; classifier for books
厕所,"toilet; lavatory; CL:間|间[jian1],處|处[chu4]"
测验,"test; to test; CL:次[ci4],個|个[ge4]"
曾经,once; already; former; previously; ever; (past tense marker used before verb or clause)
插,to insert; stick in; pierce; to take part in; to interfere; to interpose
差别,difference; distinction; diversity; disparity
叉子,fork; CL:把[ba3]
拆,to tear open; to tear down; to tear apart; to open
产品,goods; merchandise; product; CL:個|个[ge4]
产生,to arise; to come into being; to come about; to give rise to; to bring into being; to bring about; to produce; to engender; to generate; to appear; appearance; emergence; generation; production; yield
长途,long distance
常识,common sense; general knowledge; CL:門|门[men2]
抄,to copy; to plagiarize; to search and seize; to go; to transcribe; to take a shortcut; to search and confiscate
朝,imperial or royal court; government; dynasty; reign of a sovereign or emperor; court or assembly held by a sovereign or emperor; to make a pilgrimage to; facing; towards
朝代,dynasty; reign (of a king)
炒,saute; pan-fry; to fry; fried
吵架,to quarrel; to have a row; CL:頓|顿[dun4]
车库,garage
车厢,carriage; CL:節|节[jie2]
彻底,thorough; thoroughly; complete
沉默,silence; uncommunicative
趁,to avail oneself of; to take advantage of
称,to weigh; to state; to name; name; appellation; to praise
称呼,to call; to address as; appellation
称赞,to praise; to acclaim; to commend; to compliment
乘,to ride; to mount; to make use of; to avail oneself of; to take advantage of; to multiply (mathematics); Buddhist sect or creed
承担,to undertake; to assume (responsibility etc)
承认,"to admit; to concede; to recognize; recognition (diplomatic, artistic etc); to acknowledge"
承受,to bear; to support; to inherit
程度,degree (level or extent); level; CL:個|个[ge4]
程序,procedures; sequence; order; computer program
成分,composition; make-up; ingredient; element; component; one's social status; CL:個|个[ge4]
成果,result; achievement; gain; profit; CL:個|个[ge4]
成就,accomplishment; success; attain a result; achievement; CL:個|个[ge4]
成立,to establish; to set up; to be tenable; to hold water
成语,"Chinese set expression, often made up of 4 characters or two couplets of 4 characters each, often alluding to a story or historical quotation; idiom; proverb; saying; adage; set expression; CL:條|条[tiao2],本[ben3],句[ju4]"
成长,to mature; to grow; growth
诚恳,sincere; honest; cordial
吃亏,to suffer losses; to come to grief; to lose out; to get the worst of it; to be at a disadvantage; unfortunately
持续,to continue; to persist; sustainable; preservation
池子,pond; CL:個|个[ge4]
尺子,rule; ruler (measuring instrument); CL:把[ba3]
翅膀,"wing; CL:個|个[ge4],對|对[dui4]"
冲,(of water) to dash against; to mix with water; to infuse; to rinse; to flush; to develop (a film); to rise in the air; to clash; to collide with
充电器,battery charger
充分,full; abundant
充满,full of; brimming with; very full; permeated
重复,to repeat; to duplicate; CL:個|个[ge4]
宠物,house pet
抽屉,drawer
抽象,abstract
丑,"clown; surname Chou; 2nd earthly branch: 1-3 a.m., 12th solar month (6th January to 3rd February), year of the Ox"
臭,stench; stink; smelly; to smell (bad)
出版,to publish; to come off the press; to put out
出口,an exit; CL:個|个[ge4]; to speak; to export; (of a ship) to leave port
出色,remarkable; outstanding
出席,to attend; to participate; present
初级,junior; primary
除,to get rid of; to remove; to exclude; to eliminate; to wipe out; to divide; except; not including
除非,"only if (..., or otherwise, ...); only when; only in the case that; unless"
除夕,(New Year's) Eve
处理,to handle; to treat; to deal with; to process; CL:個|个[ge4]
传播,to disseminate; to propagate; to spread
传递,to transmit; to pass on to sb else
传染,to infect; contagious
传说,legend; folklore; tradition; it is said; they say that...
传统,tradition; traditional; convention; conventional; CL:個|个[ge4]
窗帘,window curtains
闯,to rush; to charge; to dash; to break through; to temper oneself (through battling hardships)
创造,to create; to bring about; to produce; CL:個|个[ge4]
吹,to blow; to play a wind instrument; to blast; to puff; to boast; to brag; to end in failure; to fall through
磁带,"magnetic tape; CL:盤|盘[pan2],盒[he2]"
辞职,to resign
此外,besides; in addition; moreover; furthermore
次要,secondary
刺激,to provoke; to irritate; to upset; to stimulate; to excite; irritant
匆忙,hasty; hurried
从此,from now on; since then; henceforth
从而,thus; thereby
从前,previously; formerly; once upon a time
从事,to go for; to engage in; to undertake; to deal with; to handle; to do
醋,vinegar
促进,to promote (an idea or cause); to advance; boost
促使,to induce; to promote; to urge; to impel; to bring about; to provoke; to drive (sb to do sth); to catalyze; to actuate; to contribute to (some development)
催,to urge; to press; to prompt; to rush sb; to hasten sth; to expedite
存,exist; deposit; store; keep; survive
存在,to exist; to be
错误,error; mistake; mistaken; CL:個|个[ge4]
措施,measure; step (to be taken); CL:個|个[ge4]
答应,to promise; to agree; to reply; to respond
达到,to reach; to achieve; to attain
打工,to work (do manual labor for a living); a part time job; to moonlight
打交道,to come into contact with; to have dealings
打喷嚏,to sneeze
打听,to ask about; to inquire about
打招呼,to greet sb by word or action; to give prior notice
大方,expert; scholar; mother earth; a type of green tea
大象,elephant; CL:隻|只[zhi1]
大型,large scale; wide scale; broad scale
呆,foolish; stupid; expressionless; blank; to stay
贷款,a loan; to provide a loan (e.g. bank); CL:筆|笔[bi3]
待遇,treatment; pay; wages; status; salary
单纯,simple; pure; alone; merely
单调,monotonous
单独,alone; by oneself; on one's own
单位,a unit; unit (of measure); work unit (one's workplace); CL:個|个[ge4]
单元,unit; entrance number; staircase (for residential buildings)
担任,to hold a governmental office or post; to assume office of; to take charge of; to serve as
耽误,delay; hold-up; to waste time; to interfere with
胆小鬼,coward
淡,insipid; diluted; weak; mild; light in color; tasteless; fresh; indifferent; nitrogen
当代,the present age; the contemporary era
挡,to resist; to obstruct; to hinder; to keep off; to block (a blow); to get in the way of; cover; gear
岛,"island; CL:個|个[ge4],座[zuo4]"
倒霉,have bad luck; be out of luck
导演,direct; director (film etc)
导致,to lead to; to create; to cause; to bring about
倒,to move backwards; converse
到达,to reach; to arrive
道德,virtue; morality; ethics; moral; CL:種|种[zhong3]
道理,reason; argument; sense; principle; basis; justification; CL:個|个[ge4]
登机牌,boarding pass
登记,to register (one's name)
等待,wait for; await
等候,waiting
等于,to equal; to be tantamount to
滴,a drop; to drip
的确,really; indeed
敌人,enemy; CL:個|个[ge4]
递,to hand over; to pass on sth; to gradually increase or decrease; progressively
地道,authentic; genuine; typical;
地理,geography
地区,"local; regional; district (not necessarily formal administrative unit); region; area; as suffix to city name, means prefecture or county (area administered by a prefecture level city or county level city); CL:個|个[ge4]"
地毯,carpet; rug
地位,position; status; place; CL:個|个[ge4]
地震,earthquake
点头,to nod
点心,light refreshments; pastry; dimsum (in Cantonese cooking); dessert
电池,"battery; CL:節|节[jie2],組|组[zu3]"
电台,transmitter-receiver; broadcasting station; radio station; CL:個|个[ge4]
钓,to fish with a hook and bait
丁,cubes of meat and vegetables; man;   members of a family; population; fourth of 10 heavenly stems 十天干; 
顶,"apex; crown of the head; top; roof; to carry on the head; to push to the top; to go against; most; to replace; to substitute; classifier for headwear, hats, veils etc; to agree or support (internet slang, similar to digg)"
冻,to freeze; to feel very cold; aspic or jelly
洞,cave; hole; zero (unambiguous spoken form when spelling out numbers); CL:個|个[ge4]
动画片,cartoon; animation
逗,to stay; to stop; to pause (while reading); to tease (play with)
豆腐,tofu; bean curd
独立,independent; independence; to stand alone
独特,unique; distinct; having special characteristics
度过,spend; pass
短信,text message; SMS
堆,a pile; a mass; heap; stack
对比,contrast; balance; CL:個|个[ge4]
对待,to treat; treatment
对方,counterpart; other person involved; opposite side; other side; receiving party
对手,opponent; adversary; match
对象,target; object; partner; boyfriend; girlfriend; CL:個|个[ge4]
对于,regarding; as far as sth is concerned; with regards to
吨,ton; Taiwan pr. dun4
蹲,to crouch; to squat
多亏,thanks to; luckily
多余,superfluous; unnecessary; surplus
躲藏,to hide oneself
恶劣,vile; nasty; of very poor quality
发表,to issue (a statement); to publish; to issue; to put out
发愁,to worry; to fret; to be anxious; to become sad
发达,developed (country etc); flourishing; to develop
发抖,shiver; shudder; tremble; tremulous
发挥,to display; to exhibit; to bring out implicit or innate qualities; to express (a thought or moral); to develop (an idea); to elaborate (on a theme)
发明,to invent; invention; CL:個|个[ge4]
发票,invoice; receipt or bill for purchase
发言,statement; utterance; CL:個|个[ge4]
罚款,(impose a) fine; penalty; fine (monetary)
法院,court of law; court
翻,to turn over; to flip over; to overturn; to translate; to decode
繁荣,prosperous; booming (economy)
凡是,every; all
反而,instead; on the contrary; contrary (to expectations)
反复,repeatedly; over and over
反应,to react; to respond; reaction; response; reply; chemical reaction; CL:個|个[ge4]
反正,to put things back in order; to return to the correct path; in any event; come what may; whatever happens (I'm still sure it's right); anyway
方,"square; power or involution (mathematics); upright; honest; fair and square; direction; side; party (to a contract, dispute etc); place; method; prescription (medicine); upright or honest; just when; only or just; classifier for square things; abbr. for square or cubic meter
"
方案,plan; program (for action etc); proposal; proposed bill; CL:個|个[ge4]
方式,way (of life); pattern; style; mode; manner; CL:個|个[ge4]
妨碍,to hinder; to obstruct
房东,landlord
仿佛,to seem; as if; alike; similar
放松,to loosen; to relax
非,non-; not-; un-; abbr. for Africa 非洲; wrong; evil-doing; insist on; simply must
肥皂,"soap; CL:塊|块[kuai4],條|条[tiao2]"
肺,lung; CL:個|个[ge4]
废话,nonsense; rubbish; superfluous words; You don't say!; No kidding! (gently sarcastic)
费用,"cost; expenditure; expense; CL:筆|笔[bi3],個|个[ge4]"
分别,to part or leave each other; to distinguish; difference; in different ways; differently; separately or individually
分布,distributed; to distribute
分配,to distribute; to assign; to allocate
分析,to analyze; analysis; CL:個|个[ge4]
纷纷,one after another; in succession; one by one; continuously; diverse; in profusion; numerous and confused; pell-mell
奋斗,to strive; to struggle
愤怒,angry; indignant
风格,style
风俗,social custom; CL:個|个[ge4]
风险,risk; venture; hazard
疯狂,madness; extreme popularity
讽刺,to satirize; to mock; irony; satire; sarcasm
否定,to negate; negative (answer); CL:個|个[ge4]
否认,to declare to be untrue; to deny
扶,to support with hand; to help sb up; to help
幅,width; roll; classifier for textiles or pictures
服从,to obey (an order); to comply; to defer
服装,dress; clothing; costume; clothes; CL:身[shen1]
辅导,to coach; to tutor; to give advice (in study)
付款,pay; payment
妇女,woman
复制,to duplicate; to make a copy of; to copy; to reproduce; to clone
改革,to reform; CL:個|个[ge4]
改进,to improve; to make better; CL:個|个[ge4]
改善,to make better; to improve; CL:個|个[ge4]
改正,to correct; to amend; to put right; correction; CL:個|个[ge4]
盖,lid; top; cover; canopy; to build
概括,to summarize; to generalize; briefly; CL:個|个[ge4]
概念,concept; idea; CL:個|个[ge4]
干脆,straightforward; clear-cut; blunt (e.g. statement); you might as well; simply
感激,to express thanks; grateful; moved to gratitude
感受,to sense; perception; to feel (through the senses); a feeling; an impression; an experience
感想,"impressions; reflections; thoughts; CL:通[tong4],個|个[ge4]"
赶紧,hurriedly
赶快,at once; immediately
干活儿,to work; manual labor
钢铁,steel
高档,superior quality; high grade; top grade
高速公路,expressway; highway; freeway
搞,to do; to make; to go in for; to set up; to get hold of; to take care of
告别,to leave; to bid farewell to; to say good-bye to
胳膊,"arm; CL:隻|只[zhi1],條|条[tiao2],雙|双[shuang1]"
鸽子,pigeon; dove; various birds of the species Columbidae
隔壁,next door
革命,revolution; revolutionary (politics); CL:次[ci4]
格外,especially; particularly
个别,individual; specific; respective; just one or two
个人,individual; personal; oneself
个性,individuality; personality
各自,each; respective; apiece
根,"root; basis; classifier for long slender objects, e.g. cigarettes, guitar strings; CL:條|条[tiao2]; radical (chemistry)"
根本,fundamental; basic; root; simply; absolutely (not); (not) at all; CL:個|个[ge4]
更加,more (than sth else); even more
公布,to announce; to make public; to publish
公开,public; to publish; to make public
公平,fair; impartial
公寓,apartment building; block of flats; CL:套|套[tao4]
公元,(year) AD; Christian era
公主,princess
工厂,"factory; CL:家[jia1],座[zuo4]"
工程师,"engineer; CL:個|个[ge4],位[wei4],名[ming2]"
工人,"worker; CL:個|个[ge4],名[ming2]"
工业,industry; CL:種|种[zhong3]
功夫,skill; art; kung fu; labor; effort
功能,function; capability
贡献,to contribute; to dedicate; to devote; contribution; CL:個|个[ge4]
沟通,communicate
构成,to constitute; to form; to compose; to make up; to configure (computing)
姑姑,paternal aunt; CL:個|个[ge4]
姑娘,girl; young woman; young lady; daughter; CL:個|个[ge4]
古代,ancient times; olden times
古典,classical
古老,ancient; old; age-old
鼓舞,heartening (news); boost (morale); CL:個|个[ge4]
股票,share; stock (market)
骨头,"bone; strong character; CL:根[gen1],塊|块[kuai4]"
固定,fixed; set; regular
固体,solid
雇佣,to employ; to hire
挂号,to register (a letter etc)
乖,"(of a child) obedient, well-behaved; clever; shrewd; alert; perverse; contrary to reason; irregular; abnormal"
拐弯,to go round a curve; to turn a corner; fig. a new direction
怪不得,lit. you can't blame it!; no wonder!; so that's why!
官,official; government; organ of body; CL:個|个[ge4]
关闭,to close; to shut
关怀,care; solicitude; to show care for; concerned about; attentive to
观察,to observe; to watch; to survey; to examine; observation; view; perspective; CL:個|个[ge4]
观点,point of view; viewpoint; standpoint; CL:個|个[ge4]
观念,notion; thought; concept; sense; views; ideology; general impressions
管子,tube; pipe; drinking straw; CL:根[gen1]
冠军,champion; CL:個|个[ge4]
罐头,tin; can; CL:個|个[ge4]
光滑,glossy; sleek; smooth
光临,(honorific) Welcome!; You honor us with your presence.; It is an honor to have you.
光明,light; illumination; radiance (esp. glory of Buddha etc); fig. bright prospect; openhearted
光盘,"compact disc; CD or DVD; CD ROM; CL:片[pian4],張|张[zhang1]"
光荣,honor and glory; CL:個|个[ge4]
广场,a public square (e.g. Tiananmen Square); plaza; CL:個|个[ge4]
广大,(of an area) vast or extensive; large-scale; widespread; (of people) numerous
广泛,extensive; wide range
规矩,lit. compass and set square; fig. established standard; rule; customs; practices; fig. upright and honest; well-behaved
规律,rule (e.g. of science); law of behavior; regular pattern; rhythm; discipline
规模,scale; scope; extent; CL:個|个[ge4]
规则,rule; regulation; rules and regulations
柜台,sales counter; front desk; bar
滚,to boil; to roll; get lost (imperative); take a hike
锅,"pot; pan; boiler; CL:口[kou3],隻|只[zhi1]"
国籍,nationality
国庆节,PRC National Day (October 1st)
果实,fruit; gains
过分,excessive; undue; overly
过敏,to be allergic; allergy
过期,to be overdue; to exceed the time limit; to expire (as in expiration date)
哈,laughter; yawn; abbr. for Kazakhstan
海关,customs (i.e. border crossing inspection); CL:個|个[ge4]
海鲜,seafood
喊,call; cry; to shout
行业,industry; business
豪华,luxurious
好奇,inquisitive; curious
和平,peace
何必,there is no need; why should
何况,much less; let alone
合法,lawful; legitimate; legal
合理,rational; reasonable; fair
合同,(business) contract; CL:個|个[ge4]
合影,joint photo; group photo
合作,to cooperate; to collaborate; to work together; cooperation; CL:個|个[ge4]
核心,core; nucleus
恨,to hate; to regret
横,horizontal; across; (horizontal character stroke)
后果,consequences; aftermath
忽视,to neglect; to ignore
呼吸,to breathe
壶,pot; classifier for bottled liquid
蝴蝶,butterfly; CL:隻|只[zhi1]
胡说,to talk nonsense; drivel
胡同,lane; alley; CL:條|条[tiao2]
胡须,"beard; CL:根[gen1],綹|绺[liu3]"
糊涂,muddled; silly; confused
花生,peanut; groundnut; CL:粒[li4]
滑冰,to skate; skating
划船,to row a boat; rowing boat; rowing (sport)
华裔,ethnic Chinese; non-Chinese citizen of Chinese ancestry
话题,subject (of a talk or conversation); topic
化学,chemistry; chemical
怀念,to cherish the memory of; to think of; reminisce
缓解,to ease; to help relieve (a crisis)
幻想,delusion; fantasy
慌张,confused; flustered
黄瓜,cucumber; CL:條|条[tiao2]
黄金,gold
皇帝,emperor; CL:個|个[ge4]
皇后,empress; imperial consort
挥,to wave; to brandish; to wipe away; to command; to conduct; to scatter; to disperse
灰,ash; dust; lime; gray; discouraged; dejected
灰尘,dust
灰心,lose heart; be discouraged
恢复,to reinstate; to resume; to restore; to recover; to regain; to rehabilitate
汇率,exchange rate
婚礼,wedding ceremony; wedding
婚姻,matrimony; wedding; marriage; CL:次[ci4]
活跃,active; vigorous
火柴,"match (for lighting fire); CL:根[gen1],盒[he2]"
伙伴,partner; companion; comrade
基本,basic; fundamental; main; elementary
机器,"machine; CL:臺|台[tai2],部[bu4],個|个[ge4]"
激烈,intense; acute; fierce
肌肉,muscle; flesh
及格,to pass a test
急忙,hastily
集体,collective; social; team; CL:個|个[ge4]
集中,to concentrate; to centralize; to focus; centralized; concentrated; to put together
记录,record; CL:個|个[ge4]
记忆,memories; remember; memory; CL:個|个[ge4]
计算,to count; to calculate; to compute; CL:個|个[ge4]
系领带,tie one's necktie
纪录,record
纪律,discipline
纪念,to commemorate; to remember; CL:個|个[ge4]
寂寞,lonely; lonesome
家庭,"family; household; CL:戶|户[hu4],個|个[ge4]"
家务,household duties; housework
家乡,hometown; native place; CL:個|个[ge4]
嘉宾,esteemed guest; honored guest
夹子,clip; clamp; tongs; folder; wallet
甲,"first of the ten heavenly stems 十天干|十天干[shi2 tian1 gan1]; (used for an unspecified person or thing); first (in a list, as a party to a contract etc); armor plating; shell or carapace; (of the fingers or toes) nail; bladed leather or metal armor (old); ranking system used in the Imperial examinations (old); civil administration unit (old)"
假如,if
假装,to feign; to pretend
嫁,(of a woman) to marry; to marry off a daughter; to shift (blame etc)
价值,"value; worth; fig. values (ethical, cultural etc); CL:個|个[ge4]"
驾驶,"to pilot (ship, airplane etc); to drive"
煎,to pan fry; to sauté
肩膀,shoulder
坚决,firm; resolute; determined
坚强,staunch; strong
艰巨,arduous; terrible (task); very difficult; formidable
艰苦,difficult; hard; arduous
尖锐,sharp; intense; penetrating; pointed; acute (illness)
捡,to pick up; to collect; to gather
简历,Curriculum Vitae (CV); résumé (resume); biographical notes
简直,simply; at all; practically
剪刀,scissors; CL:把[ba3]
健身房,gym; gymnasium
建立,to build; to establish; to set up; to found
建设,to build; to construct; construction; constructive
建议,"to propose; to suggest; to recommend; proposal; suggestion; recommendation; CL:個|个[ge4],點|点[dian3]"
建筑,building; to construct; Taiwan pr. jian4 zhu2; CL:個|个[ge4]
键盘,keyboard
讲究,to pay particular attention to; exquisite; aesthetic
讲座,a course of lectures; CL:個|个[ge4]
降落,to descend; to land
